{"artifact_kind":"app_probe_json","collection_id":"atlcol-3500000000000001","collector":{"name":"trustlab-app","version":"0.3.0-dev0"},"completion_status":"partial","ended_at":"2026-07-16T12:00:01Z","environment":{"execution_context":"app_collector","platform":"android","transport":"app_api"},"experiment_id":"E35_cross_observer","observer":{"collection_method":"app_snapshot","observer_type":"unprivileged_app","privilege_level":"app_sandbox"},"probes":[{"capability":{"api_name":"android.os.build","minimum_sdk":1},"diagnostic":null,"mechanism":"public_api","probe_id":"build_version","source_ref":"captures/build_version.txt","status":"observed","value":{"base_os_present":true,"build_fingerprint_sha256":"f1616f2cd4ecb53714738102072a3f608760472be86202141a0ca5551a563f88","build_tags":["test_keys"],"build_type":"user","release":"14","sdk_int":34,"security_patch":"2026-07-05","supported_abis":["x86_64"]}},{"capability":{"api_name":"android.process.my_uid","minimum_sdk":1},"diagnostic":null,"mechanism":"public_api","probe_id":"app_identity","source_ref":"captures/app_identity.txt","status":"observed","value":{"app_uid":10135,"debuggable":false}},{"capability":{"api_name":"android.package_manager.install_source","minimum_sdk":5},"diagnostic":null,"mechanism":"public_api","probe_id":"install_source","source_ref":"captures/install_source.txt","status":"observed","value":{"api_variant":"install_source_info","installer_present":true,"source_category":"app_store"}},{"capability":{"api_name":"proc.self.attr.current","minimum_sdk":null},"diagnostic":{"exception_class":"SecurityException","message_code":"access_denied"},"mechanism":"procfs","probe_id":"selinux_self_context","source_ref":"captures/selinux_self_context.txt","status":"inaccessible","value":null},{"capability":{"api_name":"android.system.os","minimum_sdk":21},"diagnostic":null,"mechanism":"filesystem","probe_id":"file_system_shell","source_ref":"captures/file_system_shell.txt","status":"observed","value":{"exists":true,"path_id":"system_shell","read_access":{"diagnostic":null,"status":"observed","value":true}}},{"capability":{"api_name":"android.system.os","minimum_sdk":21},"diagnostic":null,"mechanism":"filesystem","probe_id":"file_system_su","source_ref":"captures/file_system_su.txt","status":"observed","value":{"exists":false,"path_id":"system_su","read_access":{"diagnostic":null,"status":"observed","value":false}}},{"capability":{"api_name":"android.system.os","minimum_sdk":21},"diagnostic":null,"mechanism":"filesystem","probe_id":"file_system_xbin_su","source_ref":"captures/file_system_xbin_su.txt","status":"observed","value":{"exists":true,"path_id":"system_xbin_su","read_access":{"diagnostic":null,"status":"observed","value":true}}},{"capability":{"api_name":"android.system.os","minimum_sdk":21},"diagnostic":null,"mechanism":"filesystem","probe_id":"file_vendor_bin_su","source_ref":"captures/file_vendor_bin_su.txt","status":"observed","value":{"exists":false,"path_id":"vendor_bin_su","read_access":{"diagnostic":null,"status":"observed","value":false}}},{"capability":{"api_name":"android.system.os","minimum_sdk":21},"diagnostic":null,"mechanism":"filesystem","probe_id":"file_sbin_su","source_ref":"captures/file_sbin_su.txt","status":"observed","value":{"exists":false,"path_id":"sbin_su","read_access":{"diagnostic":null,"status":"observed","value":false}}},{"capability":{"api_name":"proc.self.status","minimum_sdk":null},"diagnostic":null,"mechanism":"procfs","probe_id":"proc_self_status","source_ref":"captures/proc_self_status.txt","status":"observed","value":{"bounding_capabilities_nonzero":false,"effective_capabilities_nonzero":false,"no_new_privs":true,"seccomp_filter_count":1,"seccomp_mode":2}},{"capability":{"api_name":"proc.self.mountinfo","minimum_sdk":null},"diagnostic":null,"mechanism":"procfs","probe_id":"proc_self_mountinfo","source_ref":"captures/proc_self_mountinfo.txt","status":"observed","value":{"apex_mount_count":8,"malformed_record_count":0,"record_count":38,"selected_mounts":[{"filesystem_type":"ext4","mount_point_id":"root","overlay":false,"read_only":true},{"filesystem_type":"ext4","mount_point_id":"system","overlay":false,"read_only":true},{"filesystem_type":"tmpfs","mount_point_id":"apex","overlay":false,"read_only":true}]}},{"capability":{"api_name":"android.os.build.indicators","minimum_sdk":1},"diagnostic":null,"mechanism":"public_api","probe_id":"emulator_indicators","source_ref":"captures/emulator_indicators.txt","status":"observed","value":{"indicators":["hardware_ranchu","product_sdk"],"outcome":"indicated"}}],"redaction_policy":{"applied_fields":["build_fingerprint_hashed","diagnostics_categorized","file_paths_replaced","installer_package_categorized","mount_fields_allowlisted","selinux_categories_removed"],"direct_identifiers_removed":true,"policy_id":"atl_portable_v1","redaction_state":"applied","secrets_removed":true,"serials_removed":true},"schema_version":"2.0.0","started_at":"2026-07-16T12:00:00Z","target":{"pseudonymous_id":"target-3535353535353535","target_type":"avd"}}
